{
  "rights_id": "pgrr_youtube_48_laws_shadow",
  "source_id": "pgrs_youtube_48_laws_shadow",
  "rights_status": "research_only",
  "basis": "Publicly accessible third-party YouTube video used as research evidence; no reuse license for substantial audiovisual/text reproduction has been verified.",
  "quote_policy": "research_only",
  "publication_allowed": false,
  "jurisdiction": null,
  "verified_at": "2026-09-15T17:04:00Z",
  "notes": "Use ideas as leads and paraphrase with attribution after source capture. Do not reproduce transcript or audiovisual material in the e-book unless a separate basis is verified."
}
